{
  "board_layout": {
    "columns": 1,
    "is_custom_size": false,
    "rows": 1
  },
  "cells": [
    [
      null,
      null,
      null,
      null,
      null,
      null,
      null,
      null,
      null,
      null,
      null,
      null,
      null,
      null,
      null,
      null,
      null,
      null,
      null,
      null,
      null,
      null,
      null,
      null,
      null,
      null,
      null,
      null,
      null
    ],
    [
      null,
      null,
      null,
      null,
      null,
      null,
      null,
      null,
      null,
      null,
      null,
      null,
      null,
      null,
      null,
      null,
      null,
      null,
      null,
      null,
      null,
      null,
      null,
      null,
      null,
      null,
      null,
      null,
      null
    ],
    [
      null,
      null,
      null,
      null,
      null,
      null,
      null,
      null,
      null,
      "charcoal",
      "charcoal",
      "charcoal",
      "charcoal",
      "charcoal",
      "charcoal",
      "charcoal",
      "charcoal",
      "charcoal",
      "charcoal",
      "charcoal",
      null,
      null,
      null,
      null,
      null,
      null,
      null,
      null,
      null
    ],
    [
      null,
      null,
      null,
      null,
      null,
      null,
      null,
      null,
      null,
      "charcoal",
      "charcoal",
      "charcoal",
      "charcoal",
      "charcoal",
      "charcoal",
      "charcoal",
      "charcoal",
      "charcoal",
      "charcoal",
      "charcoal",
      null,
      null,
      null,
      null,
      null,
      null,
      null,
      null,
      null
    ],
    [
      null,
      null,
      null,
      null,
      null,
      null,
      null,
      "charcoal",
      "charcoal",
      "blue",
      "blue",
      "blue",
      "blue",
      "blue",
      "blue",
      "blue",
      "blue",
      "blue",
      "blue",
      "blue",
      "charcoal",
      "charcoal",
      null,
      null,
      null,
      null,
      null,
      null,
      null
    ],
    [
      null,
      null,
      null,
      null,
      null,
      null,
      "charcoal",
      "charcoal",
      "gray",
      "blue",
      "blue",
      "blue",
      "blue",
      "blue",
      "blue",
      "blue",
      "blue",
      "blue",
      "blue",
      "blue",
      "gray",
      "gray",
      "charcoal",
      "charcoal",
      null,
      null,
      null,
      null,
      null
    ],
    [
      null,
      null,
      null,
      null,
      null,
      "charcoal",
      "charcoal",
      "gray",
      "blue",
      "blue",
      "blue",
      "blue",
      "blue",
      "blue",
      "blue",
      "blue",
      "blue",
      "blue",
      "blue",
      "blue",
      "blue",
      "blue",
      "charcoal",
      "charcoal",
      null,
      null,
      null,
      null,
      null
    ],
    [
      null,
      null,
      null,
      null,
      "charcoal",
      "charcoal",
      "gray",
      "blue",
      "blue",
      "blue",
      "blue",
      "blue",
      "blue",
      "blue",
      "blue",
      "blue",
      "blue",
      "blue",
      "blue",
      "blue",
      "blue",
      "blue",
      "gray",
      "gray",
      "charcoal",
      null,
      null,
      null,
      null
    ],
    [
      null,
      null,
      null,
      null,
      "charcoal",
      "gray",
      "blue",
      "blue",
      "blue",
      "warm-white",
      "warm-white",
      "warm-white",
      "warm-white",
      "blue",
      "blue",
      "blue",
      "blue",
      "warm-white",
      "warm-white",
      "warm-white",
      "blue",
      "blue",
      "blue",
      "blue",
      "charcoal",
      "charcoal",
      null,
      null,
      null
    ],
    [
      null,
      null,
      null,
      null,
      "charcoal",
      "gray",
      "blue",
      "blue",
      "blue",
      "blue",
      "blue",
      "blue",
      "blue",
      "blue",
      "blue",
      "blue",
      "blue",
      "blue",
      "blue",
      "blue",
      "blue",
      "blue",
      "blue",
      "blue",
      "charcoal",
      "charcoal",
      null,
      null,
      null
    ],
    [
      null,
      null,
      null,
      null,
      "charcoal",
      "gray",
      "blue",
      "blue",
      "blue",
      "blue",
      "blue",
      "blue",
      "blue",
      "blue",
      "blue",
      "blue",
      "blue",
      "blue",
      "blue",
      "blue",
      "blue",
      "blue",
      "blue",
      "blue",
      "charcoal",
      "charcoal",
      null,
      null,
      null
    ],
    [
      null,
      null,
      null,
      null,
      "charcoal",
      "gray",
      "blue",
      "blue",
      "blue",
      "blue",
      "blue",
      "blue",
      "blue",
      "blue",
      "blue",
      "blue",
      "warm-white",
      "warm-white",
      "gray",
      "blue",
      "blue",
      "blue",
      "blue",
      "blue",
      "charcoal",
      "charcoal",
      null,
      null,
      null
    ],
    [
      null,
      null,
      null,
      null,
      "charcoal",
      "gray",
      "blue",
      "blue",
      "blue",
      "blue",
      "blue",
      "blue",
      "blue",
      "blue",
      "blue",
      "blue",
      "warm-white",
      "warm-white",
      "gray",
      "blue",
      "blue",
      "blue",
      "blue",
      "blue",
      "charcoal",
      "charcoal",
      null,
      null,
      null
    ],
    [
      null,
      null,
      null,
      null,
      "charcoal",
      "gray",
      "blue",
      "gray",
      "pink",
      "blue",
      "blue",
      "blue",
      "blue",
      "blue",
      "blue",
      "blue",
      "blue",
      "blue",
      "blue",
      "blue",
      "pink",
      "pink",
      "blue",
      "blue",
      "charcoal",
      "charcoal",
      null,
      null,
      null
    ],
    [
      null,
      null,
      null,
      null,
      "charcoal",
      "gray",
      "blue",
      "blue",
      "pink",
      "blue",
      "blue",
      "blue",
      "blue",
      "blue",
      "blue",
      "blue",
      "blue",
      "blue",
      "blue",
      "blue",
      "pink",
      "pink",
      "blue",
      "blue",
      "charcoal",
      "charcoal",
      null,
      null,
      null
    ],
    [
      null,
      null,
      null,
      null,
      "charcoal",
      "gray",
      "blue",
      "blue",
      "blue",
      "blue",
      "blue",
      "charcoal",
      "charcoal",
      "blue",
      "blue",
      "blue",
      "charcoal",
      "charcoal",
      "gray",
      "blue",
      "blue",
      "blue",
      "blue",
      "blue",
      "charcoal",
      "charcoal",
      null,
      null,
      null
    ],
    [
      null,
      null,
      null,
      null,
      "charcoal",
      "gray",
      "blue",
      "blue",
      "blue",
      "blue",
      "gray",
      "charcoal",
      "charcoal",
      "blue",
      "blue",
      "blue",
      "charcoal",
      "charcoal",
      "gray",
      "blue",
      "blue",
      "blue",
      "blue",
      "blue",
      "charcoal",
      "charcoal",
      null,
      null,
      null
    ],
    [
      null,
      null,
      null,
      null,
      "charcoal",
      "gray",
      "blue",
      "blue",
      "blue",
      "charcoal",
      "charcoal",
      null,
      null,
      null,
      null,
      null,
      "charcoal",
      "charcoal",
      "gray",
      "blue",
      "blue",
      "blue",
      "blue",
      "blue",
      "charcoal",
      "charcoal",
      null,
      null,
      null
    ],
    [
      null,
      null,
      null,
      null,
      "charcoal",
      "charcoal",
      "gray",
      "gray",
      "gray",
      "charcoal",
      "charcoal",
      null,
      null,
      null,
      null,
      null,
      null,
      "charcoal",
      "charcoal",
      "gray",
      "gray",
      "gray",
      "blue",
      "blue",
      "charcoal",
      null,
      null,
      null,
      null
    ],
    [
      null,
      null,
      null,
      null,
      null,
      "charcoal",
      "charcoal",
      "charcoal",
      "charcoal",
      null,
      null,
      null,
      null,
      null,
      null,
      null,
      null,
      null,
      "charcoal",
      "charcoal",
      "charcoal",
      "charcoal",
      null,
      null,
      null,
      null,
      null,
      null,
      null
    ],
    [
      null,
      null,
      null,
      null,
      null,
      null,
      null,
      null,
      null,
      null,
      null,
      null,
      null,
      null,
      null,
      null,
      null,
      null,
      null,
      null,
      null,
      null,
      null,
      null,
      null,
      null,
      null,
      null,
      null
    ],
    [
      null,
      null,
      null,
      null,
      null,
      null,
      null,
      null,
      null,
      null,
      null,
      null,
      null,
      null,
      null,
      null,
      null,
      null,
      null,
      null,
      null,
      null,
      null,
      null,
      null,
      null,
      null,
      null,
      null
    ],
    [
      null,
      null,
      null,
      null,
      null,
      null,
      null,
      null,
      null,
      null,
      null,
      null,
      null,
      null,
      null,
      null,
      null,
      null,
      null,
      null,
      null,
      null,
      null,
      null,
      null,
      null,
      null,
      null,
      null
    ],
    [
      null,
      null,
      null,
      null,
      null,
      null,
      null,
      null,
      null,
      null,
      null,
      null,
      null,
      null,
      null,
      null,
      null,
      null,
      null,
      null,
      null,
      null,
      null,
      null,
      null,
      null,
      null,
      null,
      null
    ],
    [
      null,
      null,
      null,
      null,
      null,
      null,
      null,
      null,
      null,
      null,
      null,
      null,